{
  "schema_version": "1.0",
  "id": "ocf-cosmic-path-import-v1",
  "name": "Open Consciousness Functions",
  "version": "0.3.0",
  "review_status": "candidate",
  "human_approval": null,
  "source": "imports/ocf-cosmic-path-brand-kit-v1",
  "source_manifest_sha256": "0980501faba103ed5fdaad6108a47e3a86860f53b9d34c10a06847bb12348e01",
  "fidelity": "Supplied vector companions are not exact copies of the cinematic raster references. References are retained for comparison, not publication masters."
}
